{"schema_version":"client-event-v1","device_id":"00000000-0000-0000-0000-000000000001","binding_epoch":1,"observed_at":"2026-07-27T04:00:00.000000Z","client_seq":8,"event_id":"00000000-0000-0000-0000-000000000408","type":"BANKROLL_STATE","payload":{"base_minor":100,"cap_minor":800,"unrecovered_loss_minor":0,"next_stake_minor":100,"cycle_id":"00000000-0000-0000-0000-000000000030","cycle_version":1,"frozen_reason":null},"signature":"MEYCIQCRAyzSbe7a++Oz6oOVgAxQc8O9+eRf2/CrFQswong42QIhAJCrx+qOpDEup4CtH73kBJG8gPrba6yIpsmKQp/iXarc"}
