{"schema_version":"client-event-v1","device_id":"00000000-0000-0000-0000-000000000001","binding_epoch":1,"observed_at":"2026-07-27T04:00:00.000000Z","client_seq":2,"event_id":"00000000-0000-0000-0000-000000000402","type":"EXECUTION_STATE","payload":{"task_id":"00000000-0000-0000-0000-000000000010","period_id":"2607270001","revision":1,"state":"SUBMITTING"},"signature":"MEUCIBkK4AYT3xTNXLSZrI9MO/7XsV5NZO3gDgg/xs6pHW19AiEApobmYPhXBYhDzhCcqcNPqx22AtaDLyNY6q4RQREYsY4="}
