{"schema_version":"client-event-v1","device_id":"00000000-0000-0000-0000-000000000001","binding_epoch":1,"observed_at":"2026-07-27T04:00:00.000000Z","client_seq":7,"event_id":"00000000-0000-0000-0000-000000000407","type":"BALANCE_SNAPSHOT","payload":{"availability":"AVAILABLE","balance_minor":10096},"signature":"MEYCIQD7OAKqoBkP5Uy0PcnKhend4vkrqxqzkAwzg9KBbqIyfwIhAK1k3BwtoPMIJLlAoaCd+pQumJTg+dqcRzjdeu6sn1bD"}
