{"schema_version":"client-event-v1","device_id":"00000000-0000-0000-0000-000000000001","binding_epoch":1,"observed_at":"2026-07-27T04:00:00.000000Z","client_seq":3,"event_id":"00000000-0000-0000-0000-000000000403","type":"ORDER_CONFIRMED","payload":{"task_id":"00000000-0000-0000-0000-000000000010","period_id":"2607270001","task_revision":1,"generation":"00000000-0000-0000-0000-000000000020","client_order_id":"00000000-0000-0000-0000-000000000021","platform_order_ref":"sha256:aaaaaaaaaaaaaaaaaaaaaaaaaaaaaaaaaaaaaaaaaaaaaaaaaaaaaaaaaaaaaaaa","stake_minor":100,"confirmed_at":"2026-07-27T04:00:01.000000Z"},"signature":"MEUCIEfGPb/gNbhfJERCuQa/CJ7fG6V297ZgafN1Ide0SqhEAiEA8S2F38Cy8N3flBA+bzJ7QaaHSZ5XyvT9AaYhtqxJNuY="}
