{"schema_version":"client-event-v1","device_id":"00000000-0000-0000-0000-000000000001","binding_epoch":1,"observed_at":"2026-07-27T04:00:00.000000Z","client_seq":5,"event_id":"00000000-0000-0000-0000-000000000405","type":"ORDER_UNKNOWN","payload":{"task_id":"00000000-0000-0000-0000-000000000010","period_id":"2607270001","task_revision":1,"generation":"00000000-0000-0000-0000-000000000020","client_order_id":"00000000-0000-0000-0000-000000000023","reason_code":"CONFIRMATION_TIMEOUT","unknown_at":"2026-07-27T04:00:01.000000Z"},"signature":"MEUCIBKyErA5bTAJ+ydE75nA59kCQ6+WubLhglLkctRyXtc+AiEAmjLBRr8SkVShRZy0dkXEMxCpoC55xSeqmjQ63h8VfPs="}
