{"schema_version":"client-event-v1","device_id":"00000000-0000-0000-0000-000000000001","binding_epoch":1,"observed_at":"2026-07-27T04:00:00.000000Z","client_seq":9,"event_id":"00000000-0000-0000-0000-000000000409","type":"LATENCY_SAMPLE","payload":{"segment":"SUBMIT_TO_CONFIRM","milliseconds":240,"task_id":"00000000-0000-0000-0000-000000000010"},"signature":"MEQCIEBaV3MyC2xAa2SXPJK+74+mM+jRzwFXPcAWdtgF3rQpAiBb4B52cInbbpfvwXbN9PLg4wt10rorq2HlH8/NeyIuiA=="}
