{"schema_version":"client-event-v1","device_id":"00000000-0000-0000-0000-000000000001","binding_epoch":1,"observed_at":"2026-07-27T04:00:00.000000Z","client_seq":6,"event_id":"00000000-0000-0000-0000-000000000406","type":"SETTLEMENT_CONFIRMED","payload":{"client_order_id":"00000000-0000-0000-0000-000000000021","period_id":"2607270001","outcome":"WIN","net_pnl_minor":96,"settled_at":"2026-07-27T04:01:00.000000Z"},"signature":"MEQCIDJBCPzm4+gx9OwOlvIkmhkxY7mn0C4LsngvqRZLlINhAiADE89nHwUV9cnJmppdFKMl8LJAEjbm5Nf5NHSi5Cebvw=="}
