{"schema_version":"client-event-v1","device_id":"00000000-0000-0000-0000-000000000001","binding_epoch":1,"observed_at":"2026-07-27T04:00:00.000000Z","client_seq":1,"event_id":"00000000-0000-0000-0000-000000000401","type":"TASK_RECEIVED","payload":{"task_id":"00000000-0000-0000-0000-000000000010","period_id":"2607270001","revision":1},"signature":"MEUCIAfnNW5gcphwmgQEHp1EhPASWhFEZrtqiUPPy+o7WbQzAiEA7DHthWLsmB9HJ/YmGeKijyyH0Q0WdfVG890enJkHIHg="}
